,0
1538,"The binomial name derives from two Latin words : Turdus , `` thrush '' , and migratorius from migrare `` to go ''."
1539,"Two soundtrack albums were released , with the second coming after the first one 's massive success."
1540,"One day he comes across a female mouse named Jenny , whose parents were two of the lost six mice who tried to escape NIMH but were thought to have died in the air shaft."
1541,He serves without pay . ''
1542,Bangladesh observes Daylight saving time.
1543,"If so , an early recourse to dispute resolution may help."
1544,The dam was never rebuilt.
1545,"Nelson Piquet won the Drivers ' Championship , claiming the first of his three Formula One titles."
1546,"Anti-tank dogs were dogs taught to carry explosives to tanks , armored vehicles and other military targets."
1547,Draycot it is said went home to his meal that day.
1548,"As a result , many contestants would change alliances in order to avoid another tie and another chance of drawing the Purple Rock."
1549,Gamkrelidze was born in Kutaisi.
1550,Psychologists have attempted to measure it for well over a century.
1551,This bird 's name commemorates the American ornithologist George Newbold Lawrence.
1552,He has been married twice.
1553,Wagga Wagga is home to two major Australian Defense Force establishments.
1554,"Born in New York , New York , Jennings was owner of the New York Rangers from 1959 until his death in 1981."
1555,Lessons are generally taught in a classroom but may instead take place in a situated learning environment.
1556,Fresh pasta may include eggs.
1557,The card catalog was saved from fire damage and much of the lost book collection was replaced.
1558,"There is no standing fresh water on Malden Island , though a fresh water lens may exist."
1559,This May Day celebration began in 1870 and is approaching one hundred and forty years of age.
1560,Nailsea and Backwell railway station is managed by First Great Western.
1561,See the corresponding code below.
1562,See also the category '.
1563,"Parts of Europe , including much of Scandinavia , never adopted many feudal institutions , including serfdom."
1564,"At least three children have been born in Antarctica , albeit in stations north of the Antarctic Circle . See Demographics of Antarctica."
1565,Steinmeier was born in Detmold.
1566,A foreigner is a person from another country - See Alien.
1567,All performances must end before midnight ; long operas start earlier in the evening if need be.
1568,"For individual timelines , see."
1569,A sawmill 's basic operation is much like those of hundreds of years ago ; a log enters on one end and dimensional lumber exits on the other end.
1570,"Sukarno , born Kusno Sosrodihardjo was the first President of Indonesia."
1571,Its name means `` tree snake '' in Afrikaans and Dutch.
1572,"In 907 Herisau is mentioned for the first time , the canton is named first in 1071."
1573,He was 93 years old.
1574,"Three days later on SmackDown , Undertaker accepted Orton 's challenge."
1575,Moore would eventually have ten second place finishes in world-title competition.
1576,"Hence , Obelix was born."
1577,Signatures must not contain categories.
1578,"He never married , although his two daughters by Sarah Danby were born in 1801 and 1811."
1579,Monroe would state in her autobiography that she did not feel like a wife ; she enjoyed playing with the neighborhood children until her husband would call her home.
1580,Also see the examples below.
1581,"Other Templates also use the category , see first sorted section."
1582,White phosphorus is insoluble in water but soluble in carbon disulfide.
1583,"Zeus accepts what Hercules must do , and lets him go."
1584,"Both requests can't be satisfied , so a deadlock occurs."
1585,In New Super Mario Bros..
1586,"`` If he had been out there a minute longer , I think somebody would have shot him , '' said one witness."
1587,Half of the wireless communications were lost in the Sichuan province.
1588,"Previously , it didn't make much sense to build a pipeline that could run faster than the access latency of off-chip memory."
1589,The Vostok 1 mission was the first time anyone had journeyed into outer space and the first time anyone had entered into orbit.
1590,For the first time in its history Laing did not have a member of the founding family at the head of the company.
1591,"That night Stallone went home , and in three days he had written the script for Rocky."
1592,"In her last recording in 1950 , she recorded two songs."
1593,"In the early days of the colony of New South Wales , the southern part of the Lachlan was known as Fish River."
1594,"In any event , in going to Italy , Cervantes was doing what many young Spaniards of the time did to further their careers in one way or another."
1595,See List of EMI labels.
1596,An electric fish is a fish that can generate electric fields.
1597,"He lost his first run for Congress in 1824 , but ran again in the next election."
1598,"Bread , pasta , crackers , many cakes , and many other foods are made using flour."
1599,"The narrator , however , begins to hear a faint noise."
1600,Both tools use these words.
1601,"Since then he has subsequently appeared in many other films including My Best Friend 's Wedding , An Ideal Husband , The Next Best Thing and the Shrek sequels."
1602,"Set to only the image name , e.g. , not or."
1603,The word armadillo is Spanish for `` little armored one ''.
1604,The png images here have hand optimised transparent background color so they look good in all browsers.
1605,It may take up to 12 weeks to remove a wart.
1606,Astley recorded `` Never Gonna Give You Up '' on his 1987 album Whenever You Need Somebody.
1607,She is best known for her role as Jal Fazer in the first two seasons of Skins.
1608,Many straits are economically important.
1609,He is a right back.
1610,"MEPIS 's first official release was on May 10 , 2003."
1611,Ford Fusion is a name used on two different models of cars from the Ford Motor Company.
1612,Pilate asks the crowd whom they would like to be released.
1613,"But when the fullness of time had come , God sent his Son , born of a woman , born under the law ..."
1614,"He was 16 years , 1 month and 14 days old."
1615,It has two distinct parts.
1616,Alex 's best friend Harper is also part of the storyline.
1617,"Its name is derived from the Greek words φαίνω and ζωή , meaning make life appear , since it was once believed that life began in the Cambrian , the first period of this eon."
1618,This would be the first discovery of rings around a moon.
1619,California wine is wine made in the U.S. state of California.
1620,Toft was eventually released without charge and returned to her home.
1621,"One reviewer characterized this as `` Quite possibly Card 's best published work , ever . ''."
1622,He was 63 years old.
1623,296-8 : War with Rome.
1624,Several special bus services serve the stadium when events take place.
1625,"When the two go out , the Countess returns and hides."
1626,"48,000 during its initial run."
1627,See Firefox 's free toolbar.
1628,"For its documentation , see."
1629,Waitt is probably best known for being one of the first baseball players to wear a glove.
1630,Vishnevskaya was born in Leningrad.
1631,"Whatever your creed be , I will adore it and pray To be awaken together with you on Judgement Day Rise up once more to kiss your white throat that I may Don't pass for one more trice , my fair , don't pass by."
1632,"To hunt fish , easily their most important live prey , the eagle swoops down over the water and snatches the fish out of the water with its talons."
1633,Yehudi Menuhin was married twice.
1634,Provides an easy way to cite Geographic Names Information System data.
1635,Many composers have written Requiems.
1636,It has dense black fur.
1637,That album quickly surpassed Let 's Go in terms of success.
1638,The two major sources of tree damage are biotic and abiotic.
1639,"At the time , he did not know what this meant."
1640,Other examples of words like these are shown in the table.
1641,"If oxygen can enter , the wood might catch fire , and the production would be ruined."
1642,Dogs on leads are allowed.
1643,"He is one of only two Italian Formula One World Champions in the history of the sport , and the only one winning his two championships in a Ferrari."
1644,The clypeus is one of the sclerites that makes up the `` face '' of an arthropod.
1645,"Tracy , however , seems to have been her true love."
1646,"Microsleeps can occur at any time , typically without significant warning."
1647,It was all the truth.
1648,He was born in May 1902 into a prominent Karachi family.
1649,"The first one started to power on July 10 , 2003."
1650,Over two thirds of Coburg 's population live in Coburg City.
1651,"Any suitable tree or large bush may be used for nesting , though an evergreen is preferred."
1652,His first work called Beginning of Spring was published in 1935.
1653,Ricotta is an Italian sheep milk or cow milk whey cheese.
1654,So the name signifies that the town was at the head or end of a round hill.
1655,"Circles , tubes , cylindrical shafts , disks , and spheres may be concentric to one another."
1656,Very little is known about the habits of this unusual mouse.
1657,The leg never healed properly.
1658,This area also produces much of the wine in South Africa.
1659,He was born in Seville.
1660,It has an open world set in the fictional Paradise City.
1661,See municipalities of Baja California.
1662,The northward turn shifted the course away from any land areas.
1663,The alternative seemed to be biogenesis : that every living thing came from a pre-existing living thing.
1664,"For more information , see."
1665,None of these units survived long enough in British Rail ownership to be allocated a TOPS class.
1666,"Instead , it drinks by taking a mouthful of water , lifting its head , and letting the water run down its throat."
1667,"For example , the first player , Ann , begins a turn with a roll of 5."
1668,"Coals from a bonfire would be taken home to light the fires in family hearths , a practice thought to bring good fortune."
1669,Rosé was first violin throughout.
1670,Pasteurella multocida was first found in 1878 in fowl cholera-infected birds.
1671,Little came of this effort.
1672,Bambara has many local dialects.
1673,White rice is cooked separately.
1674,Kahn has produced work in various media but is best known for his work in public radio.
1675,"For her , with my shadow , will make three people."
1676,Scheel was born in Solingen.
1677,"Interestingly , the mouse never drinks water , instead deriving it metabolically from the foods it eats."
1678,The Kyneton Cup is on the day after Melbourne Cup day.
1679,"He lived mainly in Rome , where he would later die."
1680,"It won seven Oscars , including Best Picture and Best Director."
1681,At the end of the 1990s he set up Schuhbecks GmbH.
1682,The film is set in New York City and Los Angeles.
1683,"In the early years , every Committee member was Genevan , Protestant , white , and male."
1684,"In 2007 , PepsiCo redesigned their cans for the fourteenth time , and for the first time , included more than thirty different backgrounds on each can , introducing a new background every three weeks."
1685,"Martha and George Washington had no children together , but they raised Martha 's two surviving children."
1686,The two men strip off their tops and prepare to spar.
1687,"Additionally , Tempo was also Mozambique 's first full color magazine."
1688,We 'll never know ; we 're stuck with our interval.
1689,"The name mithril comes from two words in Sindarin - mith , meaning `` gray '' , and ril meaning `` glitter ''."
1690,"Albano was one of five children born to Dr. Carmen Louis and Eleanor Albano , both deceased."
1691,Many of the largest known primes today are generalized Fermat primes.
1692,Grandpa Never Lies is a children 's book written by Ralph Fletcher and illustrated by Harvey Stevenson.
1693,Ears are small and hairy.
1694,The two divorced in 1902.
1695,This is the first use of the name Nana since 1990.
1696,"South Pier is one of three piers in Blackpool , England."
1697,"An alternative but related hypothesis , proposed to explain the presence of life on Earth so soon after the planet had cooled down , with apparently very little time for prebiotic evolution , is that life formed first on early Mars."
1698,"Therefore , like many other female writers , Austen published anonymously."
1699,"On the good days , Dylan would sing songs to him , and at the beginning Guthrie seemed to warm to Dylan . When the bad days came Guthrie would berate Dylan and it is said that on Dylan 's last visit Guthrie didn't recognize him."
1700,The older tribes fared well.
1701,"The western half of the range lies in Ventura County , and the eastern half of the range lies in Los Angeles County."
1702,"This film was nominated for Filmfare Awards 1995 in four categories : Best Film , Best Director , Best Actor and Best Comedian."
1703,"Thus , Yoshi was born."
1704,"For the first time in many years , Jason has no fame or reputation to rely on."
1705,Progressive bluegrass is one of two major subgenres of bluegrass music.
1706,Beuchat is an international company.
1707,"Almost without exception , Welsh speakers in Wales also speak English."
1708,"Inglis describes the early Carrow Road as comprising `` a Main Stand , a covered end terrace and two large open banks ''."
1709,"However , the two younger tribes could not get anything done."
1710,"If any Man shall steal any Thing in the Company , or game , to the Value of a Piece of Eight , he shall be marooned or shot."
1711,He was 72 years old.
1712,My friend did the same.
1713,"Johnson was born in New York City , but his family returned to Britain soon afterwards , as his mother had yet to take her Oxford University final exams."
1714,"However , Tutmarc 's inventions never caught the public imagination , and little further development of the instrument took place until the 1950s."
1715,Two men disguised as government officials followed her and the crew and asked for money - at one point even showing a handgun.
1716,One of the earliest companies to take advantage of mineral resources around Ripley was the Butterley Company.
1717,"The series ended its seven-year run on May 14 , 2006."
1718,The name Euroa comes from an Aboriginal word in the old local dialect meaning `` joyful ''.
1719,We have the classic Ash responses and things like that . ''
1720,"Despite being nicknamed fool 's gold , small quantities of gold are sometimes found associated with pyrite."
1721,The river has two sources.
1722,"He coined and popularized the catch phrase `` Turn on , tune in , drop out . ''"
1723,The passage of the hurricane left 177 houses without drinking water and left four municipalities without power.
1724,"Mowgli begins to run and Baloo pushes Shere Khan away . Mowgli and Shanti run up a staircase , soon being followed by Shere Khan after Baloo tries to stop him again and soon run into a crater and jump across and land on a tiger head statue."
1725,"And Lord , haste the day when my faith shall be sight , The clouds be rolled back as a scroll ; The trump shall resound , and the Lord shall descend , Even so , it is well with my soul."
1726,"For this reason , domestic sheep on normal pasture begin to slowly decline from four years on , and the average life expectancy of a sheep is 10 to 12 years , though some sheep may live as long as 20 years."
1727,"He that shall have the Misfortune to lose a Limb in time of Engagement , shall have the Sum of Six hundred pieces of Eight , and remain aboard as long as he shall think fit."
1728,"It was one of the first animated Disney films to introduce new sound effects for regular use , to replace many of their original classic sounds , which would be used occasionally in later Disney movies."
1729,"Flock dynamics in sheep are , as a rule , only exhibited in a group of four or more sheep . Fewer sheep may not react as normally expected when alone or with few other sheep."
1730,"The antennae are rather long , with the last segment nearly as long as , or sometimes significantly longer than , the first segment ; the antennae are nearly as long as the fly 's face."
1731,The moves that one Pokémon may learn are different from another depending on the species of Pokémon ; even those that evolve from others do not necessarily learn all the same moves that their predecessors learn.
1732,"One early document discussing Hafez ' life is the preface of his Divān , which was written by an unknown contemporary of Hafez whose name may have been Moḥammad Golandām."
1733,"Water leaving the wheel or turbine is drained through a tail race , but this channel may also be the head race of yet another wheel , turbine or mill."
1734,"To enjoy qin songs , one must learn to become accustomed to the eccentric style some players may sing their songs to , like in the case of Zha Fuxi."
1735,"But for a very brief introduction by way of an example , see the Water for Life Decade page and click on `` edit '' to see the source text."
1736,He is best known for his time spent with Extreme Championship Wrestling and World Wrestling Entertainment where he was a fourteen time Hardcore Champion and a two time ECW Champion.
1737,"In 1948 he published the critically acclaimed story `` A Perfect Day for Bananafish '' in The New Yorker magazine , which became home to much of his subsequent work."
1738,"There has been much work on this topic over the years , but an interesting new idea is that meteorites may have introduced reactive phosphorus species on the early earth."
1739,"For example , during the last half of the 19th century , many grist mills were built at Saint Anthony Falls , utilizing the 50-foot drop in the Mississippi River."
1740,"Many countries issue only one passport to each national . When passport holders apply for a new passport , they may be required to surrender the old passport for invalidation."
1741,"Sanrio 's best known character is Hello Kitty , a white cat with red bow and no visible mouth , one of the most successful marketing brands in the world."
1742,"Luis was the first L name to be retired since 1954 , and was the first Atlantic hurricane name to be retired in three years since Hurricane Andrew in 1992."
1743,"The old portion of the city has many fine Renaissance era buildings decorated with exterior frescos and sculpture , as well as the impressive old canton fortress , the Munot."
1744,"In Homer , Rhea is the mother of the gods , though not a universal mother like Cybele , the Phrygian Great Mother , with whom she was later identified."
1745,But he added the scale of the disaster was such that `` we can't expect that the government can do everything and handle every aspect of the needs ''.
1746,"The months in the first half of the year all have 31 days , to take into account the slower movement of the sun across the ecliptic at this time."
1747,"She recorded `` Don't Explain '' , `` Big Stuff '' , `` You Better Go Now '' , and `` What is This Thing Called Love ? ''."
1748,"Hercules begins relating how the fire had vanished from the Earth and that Deianeira 's village needed fire , and how he got the fire back from Hera 's temple."
1749,"Their work with the abolitionist society helped attract thousands of women in New England to the movement , as many came to hear Sarah and Angelina speak at public lectures."
1750,"Their snout morphology is ideally suited for piscivory ; their long , narrow snouts offer very little resistance to water in swiping motions to snap up fish in the water."
1751,The lists are used in rotating order without regard to year ; the first name for a new year is the next name that was not used the previous year.
1752,He collaborated on Phillip 's book and provided the first descriptions of and names for many Australian bird species ; its name is Latin for `` fast-footed New Hollander ''.
1753,"On the showdown , each player plays the best poker hand they can make from the seven cards comprising his two hole cards and the five community cards . A player may use both of his own two hole cards , only one , or none at all , to form his final five-card hand."
1754,"At the end of the summer , small white flowers full of nectar appear . These attract bees , hence the genus name Melissa."
1755,"Lobsters are omnivores , and typically eat live prey such as fish , mollusks , other crustaceans , worms , and some plant life."
1756,He was followed by Crates of Thebes who gave away a large fortune so he could live a life of Cynic poverty in Athens.
1757,All common water machines until the late 19th century were basically reaction machines ; water pressure head acted on the machine and produced work.
1758,"The officers warn that Billy may cause trouble , but Vere dismisses their fears and expresses his love for the men under his command."
1759,She won two NZ Music Awards ; ` Best Female Solo Artist ' and 42 Below ` Best Selling Album in New Zealand '.
1760,"Alexis Clairaut was the first to think of polar coordinates in three dimensions , and Leonhard Euler was the first to actually develop them."
1761,"On the other hand , if you would just like them to be moved back , then by all means ask at Requested moves."
1762,"A place frequently visited by schoolchildren , it has little to offer by way of entertainment apart from a structure shaped like a shoe."
1763,"In the same series , he reflected upon his lost friends and the moment when he came face to face with a German soldier."
1764,"Therefore , the spiny mouse should never be picked up by its tail and should be handled with care to avoid a degloving injury."
1765,"His trademark hit songs include `` Indian Outlaw '' , `` Don't Take the Girl '' , `` I Like It , I Love It '' , `` Something Like That '' , `` It 's Your Love '' , and `` Live Like You Were Dying ''."
1766,"The first `` true '' seeds are described from the upper Devonian , which is probably the theater of their true first evolutionary radiation."
1767,"During these one thousand and one nights , the King had fallen in love with Scheherazade , and had had three sons with her."
1768,Silt is easily transported in water or other liquids and is fine enough to be carried long distances by air as ` dust '.
1769,"Although Connecticut has easy access to the Atlantic , between Long Island Sound and Block Island Sound , Connecticut has no direct ocean coast."
1770,"Spassky won the Soviet Chess Championship twice outright , and twice more lost in playoffs , after tying for first during the event proper."
1771,"Some frequently-occurring examples of these three classes are shown below , with live cells shown in black , and dead cells shown in white."
1772,"Lawrence conducted Pacific bird surveys for Spencer Fullerton Baird and John Cassin , and the three men co-authored Birds of North America in 1858."
1773,"Another reason for the decline of Volapük may have been the rise of Esperanto . In 1887 , the first Esperanto book was published."
1774,"A baker 's dozen , long dozen , long measure , or Roughrider 's dozen is 13 , one more than a standard dozen."
1775,"The vehicle must be returned in a good condition and must not exceed a maximum driven distance , otherwise extra fees may be incurred."
1776,"Soon afterwards , the company promoted two ECW reunion shows for ECW Alumni entitled , ECW One Night Stand in 2005 and in 2006."
1777,The main difference between early water turbines and water wheels is a swirl component of the water which passes energy to a spinning rotor.
1778,"The eastern part is lower , and is a well known wine region . The German Wine Route passes through the Palatinate wine region."
1779,"The hash sign has two horizontal lines and two slanted lines , while the sharp sign has two vertical lines and two slanted lines."
1780,"The connotation is a symbol of love and affection , not in the way of a rose , but a symbol of true love."
1781,"Mithaecus 's cookbook was an early one , but most of it has been lost ; Athenaeus quotes one short recipe in his Deipnosophistae."
1782,For the latter a bag may have one or two handles ; a shoulder bag has a strap to carry it on the shoulder.
1783,"Jonas Renkse of Katatonia , a long-time friend of Åkerfeldt , suggested writing music for two separate albums - one heavy and one soft."
1784,"Protons are composed of two up quarks and one down quark , while a neutron consists of one up quark and two down quarks."
1785,"The first half of the draft was televised live on TNN for two hours , as part of WWE 's flagship program , Raw."
1786,"Since their formation , Ensiferum has released four full-length albums , one EP , one compilation , three singles , and three demo albums."
1787,"Rice-Oxley 's and Chaplin 's mothers had become friends as Rice-Oxley 's brother was born soon after Chaplin , with their mothers becoming friends."
1788,"Discs one and two contain the full ` Piper ' album in the original mono mix , as well as the alternate stereo version."
1789,"Like Mother , Mother 3 has only a loose connection to EarthBound , starring new characters , though it does include several returning characters."
1790,"Of the three instruments built , only the last one , made by Theremin in 1978 for his niece Lydia Kavina , survives today."
1791,"Phagocytes occur in many species ; some amoebae behave like macrophage phagocytes , which suggests that phagocytes appeared early in the evolution of life."
1792,"Her other four siblings are Jeb Bush , Neil Bush , Marvin Bush , and Robin Bush , who died of leukemia in 1953."
1793,"Keynes was the first born , and was followed by two more children - Geoffrey Keynes in 1887 and Margaret Neville Keynes in 1890."
1794,"Victor Hugo 's first mature work of fiction appeared in 1829 , and reflected the acute social conscience that would infuse his later work."
