,0
2738,The body turns black shortly after.
2739,Granz helped solidify her position as one of the leading live jazz performers.
2740,"Every spring and fall , thousands of migrating birds pass through the area."
2741,"In 1966 , Howard wrote and released her first single of the year , `` Evil on Your Mind ''."
2742,He in turn appointed the ministers.
2743,"Almost two years later , Daxter has forgotten all about rescuing his friend."
2744,I waited until he came back.
2745,"One disadvantage of symmetric-key algorithms is the requirement of a shared secret key , with one copy at each end."
2746,It turns out he needs Shade 's help to find his home jungle.
2747,"There is also one First Nation with an Indian reserve , where the Chippewas of Georgina Island First Nation reside."
2748,In many racing sports an athlete will compete in a time trial against the clock to secure the fastest time.
2749,"Petroforms in the Whiteshell Provincial Park may be as old as 8,000 years."
2750,"Along with his other brothers , he was relegated to civilian life , receiving a new clan name , Ariwara."
2751,It is a cool season crop grown in many parts of the world ; planting can take place from winter through to early summer depending on location.
2752,"The Nautiloidea , on the other hand , stick to iteroparity ; they produce a few large eggs in each batch and live for a long time."
2753,The book was first published in the US by Poseidon Press in 1982.
2754,Brentwood was first founded in 1923.
2755,The Onyx River is one of the many sites studied by the US Antarctic Program of the National Science Foundation.
2756,ADHD exists alone in only about 1/3 of the children diagnosed with it.
2757,Their home stadium is Edgeley Park.
2758,"In the central Pacific , two tropical storms and two tropical depressions formed."
2759,"Sandon is one of many mining ghost towns in British Columbia , Canada."
2760,This simple tabulation has two drawbacks.
2761,Joe Doe The Example Company 604-555-1234 http://example.com/
2762,"This opened his eyes to the scale of official misconduct , and may have inspired much of his later writings."
2763,"That Man that shall snap his Arms , or smoke Tobacco in the Hold , without a Cap to his Pipe , or carry a Candle lighted without a Lanthorn , shall suffer the same Punishment as in the former Article."
2764,It was first documented in 1379.
2765,It was all about blind focus.
2766,It was first documented in 1307.
2767,Thailand is an independent country that lies in the heart of Southeast Asia.
2768,The first one was observed in 1989 by NASA 's Voyager 2 probe.
2769,It was first documented in 1305.
2770,Each member country has one vote.
2771,Gothard is the third of six children born to William and Carmen Gothard.
2772,"The name that stuck with him for life , however , was Cowboy."
2773,He was rated in the top 10 Formula One drivers of all time by longtime Formula One commentator Murray Walker.
2774,Other lectures grew into Huxley 's most famous work Evidence as to Man 's place in Nature where he addressed the key issues long before Charles Darwin published his Descent of Man in 1871.
2775,Such bunkers give the defending soldiers better protection than the open trench and also include top protection against aerial attack.
2776,"The national flag of Estonia is a tricolor featuring three equal horizontal bands of blue , black , and white."
2777,"Seahorses have a coronet on their head , which is distinct to each seahorse , much like a human fingerprint."
2778,Marcel Dupré was born in Rouen.
2779,"Lentils are mentioned many times in the Old Testament , the first time recounting the incident in which Jacob purchases the birthright from Esau with stewed lentils."
2780,"His first two operas , Almira and Nero , were produced in 1705."
2781,White is best known for his The Natural History and Antiquities of Selborne.
2782,Sparta is home to Kentucky Speedway.
2783,"Originally intended to carry passenger and freight trains by day and night , the Shinkansen lines carry only passenger trains."
2784,Adults may experience discomfort or burning.
2785,The fortresses thus lost their importance.
2786,"In reality , Longfellow 's life was much more difficult than was assumed."
2787,"It appears to be like a long katana-shaped halberd , but straighter and thinner , with a very long tsuka."
2788,London-based Peter Owen Publishers have been long-serving advocates of Kavan 's work and continue to keep her work in print.
2789,"As he battles his enemies for the first time , Parker finds juggling his personal life and costumed adventures difficult."
2790,"Lopevi lost the first challenge mainly due to Chris , however , the older men of the tribe conspired into an alliance and worked to vote off one of the younger men , Brook."
2791,See the example to the right.
2792,The outer three tepals are narrower.
2793,It falls between Wednesday and Friday.
2794,"As a measure , `` fertility rate '' is the number of children born per couple , person or population."
2795,"Until 1996 , El Paso was home to El Paso Natural Gas Company."
2796,The Wests later had two daughters.
2797,Never in my life did I draw a gun or kill anyone . ''
2798,"The language 's basic sound , along with a few words , was first devised by actor James Doohan for."
2799,There are two pairs of gills.
2800,It was first documented in 1226.
2801,The Rhine-Main-Danube Canal begins near Bamberg.
2802,"After having supper , and telling the hostages not to raise the alarm for another three hours , they left."
2803,"However , many professional players prefer skin heads because they feel the heads produce a warmer , better quality timbre."
2804,"For example , in sheep , it may be caused by crowding through doors , or being chased by dogs."
2805,Ian attempted to make ammends but Katie still held bad feelings towards him.
2806,He soon vows revenge against Shade.
2807,"An electronic multiplexer makes it possible for several signals to share one device or resource , for example one A/D converter or one communication line , instead of having one device per input signal."
2808,"Anna was born at Flatbrookville , Walpack Township , New Jersey on July 25 , 1775 to Judge John Cleves and Anna Tuthill Symmes of Long Island."
2809,"If true , this would imply that there are no odd perfect numbers."
2810,"Born and raised in Vienna , he began writing at an early age."
2811,Laika was a Soviet space dog who became the first animal to orbit the Earth and the first orbital death.
2812,Season One primarily focuses on the affect of Amy Juergens unwillingly having sex for the first time at band camp.
2813,"Since the early 1930s , the company has also promoted spin-off reference works."
2814,"In 1970 , the Sultan introduced a complete new set of national flags."
2815,An aqueduct is a water supply or navigable channel constructed to convey water.
2816,"It took a long time for the cathedral to be built , and during that time tastes in architecture changed."
2817,Travel times to Munich have been reduced to as little as one hour.
2818,In the 1590s three of his children were baptized in the Oude Kerk.
2819,That way the Jews spoiled and poisoned the French people too much ''.
2820,The NBL/MAN engines were built by the North British Locomotive Company in Scotland under licence from the German company MAN.
2821,Stems may point up or down.
2822,"Although lobster skin has been found in lobster stomachs , this is because lobsters eat their shed skin after molting."
2823,"Even though it is classified as a long bone , the clavicle has no medullary cavity like other long bones."
2824,The recipient may remove this template from his/her talk page at any time.
2825,Gober served two tours in Vietnam.
2826,Niue uses the New Zealand dollar.
2827,Empty or missing parameters are ignored.
2828,They eat invertebrates and small vertebrates.
2829,The name Flora was later retired.
2830,"Longoria was given the American League Gold Glove Award for his position on November 10 . Two days later , he was given a Silver Slugger Award."
2831,Neither attempted to predict new elements.
2832,"The jungle cat , also called the swamp lynx , is a medium-small cat and today considered the largest remaining species of the wild cat genus Felis."
2833,Sound can not travel through vacuum.
2834,"If you would like to experiment further , please use the sandbox instead."
2835,"It was first broadcast on BBC One between January 2006 and April 2007 , lasting for two series in total."
2836,Seiko Holdings is one of the three core companies of the Seiko Group.
2837,"Today , it is best known as the birthplace of many celebrated Romanians , including Mihai Eminescu and Nicolae Iorga."
2838,Traditional raised beds promote good drainage.
2839,"On an artistic color wheel , complementary colors are placed opposite one another."
2840,Bartlet 's first campaign for president is never significantly explored in the series.
2841,"Located in one of the holiest sites in the old city of Damascus , it is of great architectural importance."
2842,"Up to 100,000 houses lost power as tree branches fell on power lines."
2843,Dead links in one or two languages are therefore no cause for concern.
2844,It was the first time a pope paid a visit to a mosque.
2845,"In 1925 , she was awarded a gold medal for one of them in the first Arts Décoratifs ' exhibition."
2846,"By the end of 2003 , Green Day collaborated with Iggy Pop on two tracks for his album Skull Ring."
2847,"In October 2008 , he dropped out of the world top three ranking for the first time since July 1996."
2848,Tube sound is the characteristic sound associated with a vacuum tube-based audio amplifier.
2849,Rocky Rapids has one store at the hamlet center . Other home businesses are ran in Rocky Rapids as well.
2850,"BTS is a limited company wholly owned by Blackpool Borough Council , which makes it one of the few remaining municipal bus companies in the UK today."
2851,Tourist sport fishermen and vacationers are free to fish in the lake as long as they don't use nets.
2852,"It flies with body and tail held level , with slow wing beats."
2853,"However , he admits that like many models of the origin of life , his own also has its shortcomings."
2854,Thomas Mann wrote of Tolstoy 's seemingly guileless artistry : `` Seldom did art work so much like nature ''.
2855,None of these laws carry the distinctive punishment reserved for the common scold.
2856,"This group is set on , and may use to set permissions on any wikimedia wiki ; they may add or remove any user from any group."
2857,This first semen volume is small.
2858,For more technical details see the.
2859,"At Arles , near its mouth at the Mediterranean Sea , the river divides into two branches , known as the Great Rhone and the Little Rhone."
2860,"But being should not be confused with being or , let alone or."
2861,"Under extreme climatic conditions , a biennial plant may complete its life cycle in a very short period of time."
2862,Körös is the name of a 195 km long river in eastern Hungary.
2863,"Despite their spines , they are preyed on by birds , the Tasmanian Devil , cats , foxes and dogs."
2864,The colonizing population may diversify rapidly to take advantage of all possible niches.
2865,He also said that it was `` not correct to say that a soldier can not live without smoking . ''
2866,One of the best known philosophical theories of autonomy was developed by Kant.
2867,"On May 23 , the group 's first mini-album , Replay was released."
2868,In Caracas and in Valencia twice as many people view RCTV than Venevision.
2869,It was first published in 1999.
2870,Thyme is best cultivated in a hot sunny location with well drained soil.
2871,She is also the first Italian-American and first Californian to serve as Speaker.
2872,"On September 25 , Hurricane Jeanne began a slow turn to the east."
2873,The tribe speak the Dhundi-Kairali dialect.
2874,Young Alice was one of the first seven students in the United States.
2875,"For cats in general , see."
2876,Tim Hortons ' first stores only offered two products - coffee and doughnuts.
2877,"The attack works by encrypting from one end and decrypting from the other end , thus meeting in the middle."
2878,"The journaling in NetApp WAFL file system gives atomicity by never updating the data in place , as does ZFS."
2879,La Mina lost again and Casaya chose Terry to go to Exile Island for the second time in a row.
2880,"In reality , the Clinton Administration didn't intervene in Rwanda , making series events look like a moral imperative."
2881,"Back at Casaya , Tina caught a sizeable fish while Ruth-Marie and Melinda targeted Cirie for being a weak link."
2882,"Matthew Fox stated in an interview that in the final season , the characters of Jack Shephard and John Locke `` will come head to head . ''"
2883,"The adjectival form of the name , although unused , would be Astraean."
2884,Water turbines are divided into two groups ; reaction turbines and impulse turbines.
2885,February 1 is Baked Alaska Day.
2886,The brothers and their friends then began to work for other independent companies.
2887,"Darren Middleton is an Australian guitarist , best known as one of two lead guitarists for alternative rock band Powderfinger."
2888,Tropical Storm Claudette was one of three tropical storms active on August 16.
2889,"In early 2007 , the band supported My Chemical Romance as openers on the first half of their arena tour."
2890,No one was killed by Julio.
2891,A drop goal is scored in open play by drop kicking the ball over the crossbar and between the uprights.
2892,"In the episode , Homer makes a wish for Ned Flanders 's new left-handed store to go out of business."
2893,Economic circumstances also affect life expectancy.
2894,They are rarely seen outside water.
2895,None of the class was named.
2896,She was raised by two aunts.
2897,It is named after one of the Alkyonides ; the name means flowery.
2898,TAKE THAT : The Ultimate Tour is a video by boyband Take That.
2899,"Dark Horse 's film arm , Dark Horse Entertainment , produces films and TV shows based on Dark Horse Comics."
2900,"Two brothers , Elliott Roosevelt , Jr. and Hall Roosevelt were born later."
2901,The first single was `` Hidin ' from Love '' in 1980 which was followed up by `` Give Me Your Love '' and `` Remember ''.
2902,We take 1 α = 0.95.
2903,An organic brain may or may not be considered a data storage device.
2904,Soon Marcello is burning with jealousy.
2905,There is another village of the same name in the Mid Devon district.
2906,Ganz is a Canadian company best known for distributing plush animals and collectibles.
2907,"The pebbles may be made of water ice and are somewhat rounded , which may indicate the action of fluids."
2908,"It can jump and climb exceptionally well , which enables it to catch hyraxes better than probably any other carnivore."
2909,Rowling made Harry an orphan from the early drafts of her first book.
2910,"Chitons have a relatively good fossil record , stretching back to the Devonian."
2911,He was one of the first Patriots to advocate complete independence from Britain.
2912,The first cemetery in Victoria was established at Point Gellibrand at this time.
2913,In 1900 the indigenous Governor Brothers terrorised much of northern New South Wales.
2914,"There are three instances where two separate stations share the same name : Edgware Road , Hammersmith and Canary Wharf."
2915,This was completed later that day.
2916,"In the Western Christian calendar , Ash Wednesday is the first day of Lent and occurs forty-six days before Easter."
2917,"Lake Chargoggagoggmanchauggagoggchaubunagungamaugg , a 45-letter alternative name for this body of fresh water , is often cited as the longest place name in the United States and one of the longest in the world."
2918,"In a twist that would eventually lead to its use in later seasons , one individual immunity challenge required the first player to drop out to spend a night alone on an isolated island."
2919,"The newly-developed Darwin Centre is designed as a new home for the museum 's collection of tens of millions of preserved specimens , as well as new work spaces for the museum 's scientific staff , and new educational visitor experiences."
2920,"On that case , an opponent must accuse him and the piece that did not capture must go to jail."
2921,Only `` name '' is required.
2922,Those performances qualified Kim for the Grand Prix Final for the first time.
2923,His aim was to let Holiday tell her story in her own way.
2924,I never knew what kind of day we were going to have ... would she be cooperative or obstructive ? ''
2925,The template has only one parameter : a real number without thousand separators.
2926,Here is how these templates look.
2927,"Dave was left with nothing , forcing him to take up the drums."
2928,The project 's famous Fish Mouth was cracked but not severely damaged otherwise.
2929,Then they are rinsed until the water runs through and comes out clear.
2930,"Waves along the coastline of New York reached 4 t. On August 14 , a 16-year-old boy drowned after being caught in a rip current near Long Beach , New York on August 14."
2931,Tina is never even alluded to.
2932,"They may be cooked on the stovetop , or in a slow cooker."
2933,The movie 's working titles were Mission Without Permission and Catch That Girl.
2934,The first instance of the name was during the British rule of India.
2935,"His middle name was in honor of former President Theodore Roosevelt , who died twenty-five days before Robinson was born."
2936,Its county seat is New Bern.
2937,"This figure gives name to the hill , the range and the vale."
2938,Adams has been awarded three honors.
2939,Alexandre Guilmant was born in Boulogne-sur-Mer.
2940,Highly eusocial bees live in colonies.
2941,Often they are decorated with frosting or marzipan made to look like carrots.
2942,"John Bardeen was born in Madison , Wisconsin on May 23 , 1908."
2943,"If the parameter is empty or missing , it returns an empty string."
2944,Hurricane Bill became the first hurricane and first major hurricane of the season.
2945,The opposite of night is day.
2946,"In other words , Wikipedia is."
2947,"The white top segment , shows a ship at sea in full sail."
2948,A stem is one of two main structural axes of a vascular plant.
2949,"The earliest chansons were for two , three or four voices , with first three becoming the norm , expanding to four voices by the sixteenth century."
2950,After 15 days the lichens were brought back to earth and were found to be in full health with no discernible damage from their time in orbit.
2951,"The album featured Thile 's suite `` The Blind Leaving the Blind '' , as well as other original songs."
2952,"The second bridge , which took eight years to build , was the first in London to carry trams and later one of the first two roads in London to have a bus lane."
2953,"Donaldson was born on 2 April 1979 at Waratah , New South Wales."
2954,St. Louis Blues may refer to :
2955,Canowindra is the site of one of the world 's great fossil discoveries.
2956,"The first three genera contain viruses that cause influenza in vertebrates , including birds , humans , and other mammals."
2957,It takes place between The Battle of the Labyrinth and The Last Olympian.
2958,"The Indian Pacific also stops twice a week , as well as the Broken Hill Outback Xplorer service , run by CountryLink , which heads to Broken Hill on Mondays and Sydney on Tuesdays."
2959,Lípa was first documented in 1351.
2960,"Daniel Handler , still under the name of Lemony Snicket , announced that he would write 4 more books that would be darker than his first series."
2961,The smallest field has two elements.
2962,"In a cascading configuration , the doors run on independent tracks so that while open , they are tucked behind one another , and while closed , they form cascading layers on one side."
2963,He would publicly maintain that he had lost all interest in the project.
2964,Doraemon is sent back in time by Nobita Nobi 's great-great grandson Sewashi to improve Nobita 's circumstances so that his descendants may enjoy a better future.
2965,See intension for some more discussion.
2966,"The couple had two children , Millard Powers Fillmore and Mary Abigail Fillmore."
2967,"Like standard rail tracks , tram tracks consist of two parallel steel rails."
2968,Fecundation is another term for fertilization.
2969,"When Crane let him back to the table , Moore ran 142 balls."
2970,See Persondata for the detailed documentation.
2971,It was first documented in 1436.
2972,"White Stone is a town in Lancaster County , Virginia , United States."
2973,Interstate 88 is 140.60 m long.
2974,The class contains two extant subclasses.
2975,"When DES was approved as a federal standard in 1976 , a machine fast enough to test that many keys in a reasonable time would have cost an unreasonable amount of money to build."
2976,"SM Entertainment announced that Shinee would make their comeback with their second mini album Romeo on May 21 , 2009."
2977,It wasn't named but the recipe was similar to today 's Pavlova.
2978,It is regarded as one of the supreme masterpieces of the Early Renaissance.
2979,"For instance , there are two nines on the A scale ; to find the square root of nine , use the first one ; the second one gives the square root of 90."
2980,The Islamabad Capital Territory is one of the two federal territories of Pakistan.
2981,"Before Black Eyed Peas , will."
2982,"To use this template , put."
2983,Saboga chose to give some taste of reward to the other two tribes.
2984,"Three people were reported injured on the island , with two others dead."
2985,Ignacio lost tropical characteristics August 19.
2986,Law varies from place to place and it evolves over timesometimes quite quickly.
2987,One person was killed in Tecpan.
2988,"On 27 May 2008 , the company was transferred back into public ownership under the authority of Transport for London."
2989,"La Mina tried to organize their camp , but were lost without Terry."
2990,"Ottavio , not convinced , determines to keep an eye on his friend."
2991,"In general , men suffer from many of the same illnesses as women."
2992,William Regal got his job back by being the first to join Vince McMahon 's infamous Kiss My Ass Club.
2993,The county 's main river gives it its name : the Dâmboviţa River.
2994,Adjectives are declinable in similar way.
2995,The Short-beaked Echidna can live as long as forty-five years in the wild.
2996,Andernos-les-Bains has a long sand beach.
2997,See the example below for details.
2998,Minnie first appeared in Plane Crazy.
2999,She was hanged over the fire with a rope and she fell into the fire when the rope burned through.
3000,"A third of the way through the final season , the two time lines will be `` solidified into one '' and `` will be very linear - no more flashbacks , nothing . ''"
3001,Senior high school has three grades.
3002,"Sir Run Run Shaw CBE , GBM is a Hong Kong media mogul."
3003,A forest of great age is called old growth forest or ancient woodland.
3004,"Lace is an openwork fabric , patterned with open holes in the work , made by machine or by hand."
3005,An oxide is a chemical compound containing at least one oxygen atom as well as at least one other element.
3006,They are slimy and are often seen at the edge of bodies of water with their eyes above the water.
3007,MSX was the name of a standardized home computer architecture in the 1980s.
3008,Please do not make personal attacks.
3009,Claudius wrote copiously throughout his life.
3010,Their debut album was Sixteen Stone.
3011,"In 1923 , Tailleferre began to spend a great deal of time with Maurice Ravel at his home in Monfort-L'Amaury."
3012,"Shaw himself guest conducted from time to time , ending his self-imposed retirement."
3013,The migration from water wheels to modern turbines took about one hundred years.
3014,Initiation may be thought of as an event which may help teens prepare themselves to be good husbands and wives.
3015,They may also be in the public domain in other countries as well.
3016,His lyrics loosen up enough to sing about skin creams and powder advertised as being able to lighten dark skin.
3017,"It is compiled every Wednesday by U.S.-based music sales tracking company Nielsen Soundscan , and published every Thursday by Jam !"
3018,Murtagh becomes Eragon 's new companion.
3019,"It is called `` black '' because it absorbs all the light that hits it , reflecting nothing , just like a perfect black body in thermodynamics."
3020,"Shacks were severely damaged by the strong winds , widespread tree damage was reported and many areas lost electricity service."
3021,"In the case of asteroids , so many have been discovered that many will never be named by their discoverers."
3022,Large populations of dugongs live there.
3023,Many notable events occurred in 1903.
3024,Jinnah was the eldest of seven children born to Mithibai and Jinnahbhai Poonja.
3025,At Judgment Day 2006 Long fired Melina and Johnny Nitro from SmackDown !.
3026,This series would also mark the end of a long period of invulnerability for the Yankees in the World Series.
3027,Species may be succulent or not.
3028,"Although aspects of this trend in painting had already appeared in Rome in the work of Pietro Cavallini , Giotto took it so much further that he set a new standard for representational painting."
3029,"Kennedy ran , firing as he sought cover moving from tree to tree."
3030,A water turbine is a rotary engine that takes energy from moving water.
3031,No one on the street was injured but the cleanup took many weeks.
3032,Repco is an Australian engineering company.
3033,"Some white supremacists identify themselves as Odinists , although some Odinists reject white supremacy , and white supremacists are only one faction of those who support Odinism."
