,0
3934,"After a three-season run , the sketch was developed into a half-hour prime time show and was an early hit for Fox."
3935,In 2003 he was ranked 10th on Rolling Stone magazine 's `` Rolling Stone 's 100 Greatest Guitarists of All Time ''.
3936,"Like the Nile , the Niger floods yearly ; this begins in September , peaks in November , and finishes by May."
3937,"Tarrasch haughtily declined , stating that Lasker should first prove his mettle by attempting to win one or two major international events."
3938,"The nucleus of tritium contains one proton and two neutrons , whereas the nucleus of protium contains one proton and no neutrons."
3939,Welch would like to have a career similar to PJ Harvey and Björk who are `` constantly creating new exciting stuff ''.
3940,An adult hagfish can secrete enough slime to turn a 20 litre bucket of water into slime in a matter of minutes.
3941,Old Faithful was named in 1870 during the Washburn-Langford-Doane Expedition and was the first geyser in the park to receive a name.
3942,"The book focuses mostly on his life since the 1987 publication of his first autobiography , Metamorphosis : Stages in a Life."
3943,"Its oval-shaped head features prominent whiskers , black-and-brown ears , and a koban , a gold oval coin embedded in its forehead."
3944,"Pierre Corneille was a French tragedian who was one of the three great seventeenth-century French dramatists , along with Molière and Racine."
3945,"Angel eventually set out on a path of redemption , hoping that he could make up for his past through good deeds."
3946,"Majority rule is a decision rule that selects one of two alternatives , based on which has more than half the votes."
3947,"Steinitz had previously declared he would win without doubt , so it came as a shock when Lasker won the first game."
3948,"The project would bring the maximum output of the facility to 40 GW , twice that of China 's Three Gorges Dam."
3949,The event was the third WrestleMania at Madison Square Garden but the fourth to take place in the New York metropolitan area.
3950,"More than half of the workers in Aarau live in the city 's suburbs , or farther away in the surrounding area."
3951,Norton Internet Security held a 61 % market share in the US retail security suite category in the first half of 2007.
3952,"The various types of debt can generally be categorized into : 1 secured and unsecured debt , 2 private and public debt , 3 syndicated and bilateral debt , and 4 other types of debt that display one or more of the characteristics noted above."
3953,"The glockenspiel 's range is limited to the upper register , and usually covers about two and a half to three octaves."
3954,"She was first shown in the guise of Sheik , but it was later revealed that Sheik was one of two forms."
3955,"Born in 1048 CE and originating from Nisa , he ranks as one of the great masters of the Persian panegyric qasideh."
3956,"In The Brothers Karamazov , the character Dmitri Karamazov asks his atheist friend Rakitin , '' ... without God and immortal life ?"
3957,"Like most arthropods , spiders lack balance and acceleration sensors and rely on their eyes to tell them which way is up."
3958,Aikido is often translated as `` the Way of unifying life energy '' or as `` the Way of harmonious spirit . ''
3959,"In October 2008 , Pepsi announced that it would be redesigning its logo and re-branding many of its products by early 2009."
3960,"Salland may have been the early seat of the Salian Franks , the founders of the early mediaeval empire of the Franks."
3961,"Anastasia uses the wand to turn herself back to normal and then gives it to Cinderella , who revives the Fairy Godmother."
3962,"Generally , only men of high economic and social status have concubines . Many historical rulers maintained concubines as well as wives."
3963,The promoter sees new cash flows as investors are told they could not transfer money from the first plan to the second.
3964,Jimmie Foxx was the first player to win multiple times ; ten players have won three times and seventeen have won twice.
3965,"At the tree line , tree growth is often very stunted , with the last trees forming low , densely matted bushes."
3966,This was also the third time the name `` Jose '' had been used to name a tropical cyclone in the Atlantic.
3967,Men are supposed to come to the mosque wearing loose and clean clothes that do not reveal the shape of the body.
3968,"To make your code readable and easy to edit , you can put each wrappable `` line '' on its own line."
3969,"The name of the book comes from the first verse , `` The Song of songs , which is Solomon 's . ''"
3970,"The Glossy-mantled Manucode , Manucodia ater , is a medium-sized , around 42 cm long , glossed green , blue and purple black bird of paradise with a red iris , black bill , long graduated tail and somewhat elongated upper breast and neck feathers."
3971,By the early eighteenth century brick making had been extended and four shops and one or two alehouses established on the common.
3972,"Rather , a good S-box will have the property that changing one input bit will change about half of the output bits."
3973,Marie Skłodowska - Curie was the first woman to win a Nobel prize and the first person to win two Nobel Prizes.
3974,"Neither hypothesis actually answers the question of how life first originated , but merely shifts it to another planet or a comet."
3975,Ania see Pithus outside the window and Hercules goes to tell him that the village doesn't need the help of Hercules.
3976,"Stuff is a collection , set , or group of items , things , or matter . Stuff may also refer to :"
3977,One day he accidentally rode stark naked through the outdoor set of a silent movie in production and was `` discovered . ''
3978,"He put a cinder block and rope in the truck , put Austin in it , and drove away on the truck."
3979,"The Red Sox won the series four games to three , having been down three games to none in the best-of-seven series."
3980,"Although most people without CF have two working copies of the CFTR gene , only one is needed to prevent cystic fibrosis."
3981,"Older children could continue in other communist organizations , but that would typically be done only by a limited number of people."
3982,"Voyager 2 discovered an anticyclone called the Great Dark Spot , similar to Jupiter 's Great Red Spot and Little Red Spot."
3983,These moths have thin bodies and large wings like many butterflies but may be distinguished easily by structural differences in their antennae.
3984,"One man agrees but he is tricked when he is introduced to the real boxer , a towering brute of a man."
3985,"There are also two shops , a chemist , a Chinese take away , a butcher and a post office and florist."
3986,"The name of the village is a local curiosity , as its pronunciation differs to how one may try to pronounce it."
3987,Information in this template may need to be updated from time to time as we obtain more information about the targeted user.
3988,"This went into many editions and translations in later years , and became a standard reference work for scientists in many disciplines."
3989,"In the last six years , Slovakia has won three medals at the World Championships , including a gold medal in 2002."
3990,Many of the words in the modern Indo-European languages seem to have derived from such `` protowords '' via regular sound changes.
3991,Grand Central Railway Company Ltd is a privately-owned train operating company running services under the name Grand Central within the United Kingdom.
3992,"In climate it is similar to the neighbouring Burgenland wine region in Austria , and several winemakers make wine in both countries."
3993,"On the basis of his discoveries , Flemming surmised for the first time that all cell nuclei came from another predecessor nucleus."
3994,She won the 2008 French Open and was the runner-up in singles at the 2007 French Open and the 2008 Australian Open.
3995,"In two appearances as a pitcher , Wistert allowed only one run in eight innings , for a career ERA of 1.13."
3996,"Little Bastard soon became more and more aggressive and started attacking Finlay 's opponent during matches , much to Finlay 's dismay."
3997,"Jeremy Silman ranked him as one of the five best endgame players of all time , and a master of rook endgames."
3998,"After twenty-eight days at sea , balsam in the ship 's cargo caught fire and the crew was forced to abandon ship."
3999,"He received his first music lessons from his mother , who was a singer , and began composing at an early age."
4000,"Erasmus Darwin House , his home in Lichfield , is now a museum dedicated to Erasmus Darwin and his life 's work."
4001,"As a result , the bats were banished to the night , never to see the sun again without suffering terrible penalties."
4002,South Korea aims to put a robot in every house there by 2015-2020 in order to help catch up technologically with Japan.
4003,Two late night c2c trains pass through the station each day on the way from Liverpool Street to Barking and vice versa.
4004,Mill argues that society should never use coercion to subdue an individual as long as he or she does not harm others.
4005,Many of the generalizations noted above do not hold true for some schools of jujutsu . Old schools of Japanese jujutsu include :
4006,"Hercules goes through the fire and retrieves the Torch , he throws it and it lands in Prometheus 's home waking him."
4007,"Classic Case did a cover of `` Fell on Black Days '' on the band 's 2006 EP , Black Unicorn Split."
4008,"They are born without quills , which develop in the following days . The quills are easily visible within hours of birth."
4009,"Colin Powell , a long time advocate , has recommended a simple moment of silence at the start of each school day."
4010,"In the Central Pacific Hurricane Center 's area of responsibility , three depressions , two tropical storms , and one hurricane formed."
4011,"In September 2001 , he went to Wolverhampton Wanderers on a three-month loan , scoring two goals in his first two games."
4012,The game is set in the fictional location of Spiral Mountain where a bear named Banjo and a bird named Kazooie live.
4013,"The name comes from the Greek typhos meaning smoky or hazy , describing the state of mind of those affected with typhus."
4014,Press releases have stated `` it would allow digitally literate children the access to characters and resources they had come to expect.
4015,Soda bread is a type of quick bread in which bread soda is used for leavening rather than the more common yeast.
4016,`` All We Know '' is the third and final single from Paramore 's first studio album All We Know Is Falling.
4017,"Because of this low elevation , the islands that make up this nation may be threatened by any future sea level rise."
4018,"A micrometre or micron is one millionth of a metre , or equivalently one thousandth of a millimetre or one thousand nanometres."
4019,"The US is the world 's single most powerful country , but much weaker than the rest of the world put together."
4020,The two tier architecture means that the client acts as one tier and application in combination with server acts as another tier.
4021,"In Bus Stop , Monroe played Chérie , a saloon bar singer with little talent who falls in love with a cowboy."
4022,"Three other Pacific storms , two of which were hurricanes , and three Atlantic storms also had a direct impact on Mexico."
4023,"When her old husband comes home from the hills , he is astounded to find a dazzling young lady in his house."
4024,"Three hundred sixty-two Trojan athletes have participated in the Olympic games winning 112 gold , 66 silver , and 58 bronze medals."
4025,"The match consists of thirty contestants , beginning with the two wrestlers who chose entry numbers one and two in the ring."
4026,The first European settlers crossed Bass Strait landing near Geelong and worked their way up the Moorabool River with their sheep flocks.
4027,This version incorporates the famous `` You 'll never catch me alive said he '' variation introduced by the Billy Tea company.
4028,Pangolin are hunted and eaten in many parts of Africa and it is one of the more popular types of bush meat.
4029,Another formulation of this idea came later : `` Organisms which never leave their ancient area of distribution will never change ''.
4030,"Like the genera that Stebbins had previously studied , Crepis commonly hybridized , displayed polyploidy , and could make seed without fertilization."
4031,"The first of Strabo 's major works , Historical Sketches , written while he was in Rome , is nearly completely lost."
4032,"`` If Bessie had been old enough , she would have gone with him , '' said Clarence 's widow , Maud."
4033,On her deathbed Sorcha tells Iubdin that he must return to Harrowfield and learn the truth about John and Margery 's son.
4034,"The Weinsteins started a new film production company called simply The Weinstein Company , and took the Dimension Films label with them."
4035,"Though much of his work is categorized as lyric poetry , Longfellow experimented with many forms , including hexameter and free verse."
4036,"The North Island is one of the two main islands of New Zealand , separated from the South Island by Cook Strait."
4037,"Best known for his work as the Andy Hardy character , Rooney has had one of the longest careers of any actor."
4038,"Although feedback is an important aspect of control engineering , control engineers may also work on the control of systems without feedback."
4039,The Last Olympian revolves around the demigod Perseus Jackson as he leads his friends in a last stand to protect Mount Olympus.
4040,"A war between the Others and the survivors comes to a head , and the survivors make contact with a rescue team."
4041,"Many people know Reims for its cathedral , Notre-Dame de Reims , formerly the place of coronation of the kings of France."
4042,"The company initially performed at the Old Vic , their first production being Hamlet , directed by Olivier and starring Peter O'Toole."
4043,The structure allows repeating information using parent/child relationships : each parent can have many children but each child only has one parent.
4044,"She also supports the Love Our Children USA organization , which named her among their Mothers Who Make a Difference in 2009."
4045,"In this process , good works are more of an unessential byproduct that contribute nothing to one 's own state of righteousness."
4046,Two points are awarded ; one for the team with the highest average and one for the individual with the hardest shot.
4047,The name ecliptic arises because eclipses occur when the full or new Moon is very close to this path of the Sun.
4048,"The forester , also on his way home , sees the vixen and fires two shots at her , sending her running."
4049,They were briefly left without a drummer until they were able to lure Skin Yard drummer Matt Cameron away from his band.
4050,"The eye may also represent secrecy , again playing on the ambiguous lack of detail about the old man or the narrator."
4051,"It was built in the sixth century BC , but was destroyed in the Great Fire of Rome during Nero 's reign."
4052,"So if then the dash will be one em in length , if it will be two em long and so on."
4053,"He was the youngest of eight children , born into one of the most prominent and wealthy families in the Austro-Hungarian empire."
4054,"The CBO became a full time organization in 1944 , changing its name to the City of Birmingham Symphony Orchestra in 1948."
4055,At the time of European settlement Araluen was described as a broad alluvial valley with many natural billabongs covered with water lilies.
4056,COBE was the first experiment to measure '' ... the black body form and anisotropy of the cosmic microwave background radiation . ''
4057,"New Line also released many classic foreign-language films , like Stay as you are , Immoral Tales and Get Out Your Handkerchiefs."
4058,"The season finale was on May 14 , 2006 with the votes revealed live from the Ed Sullivan Theater in New York."
4059,"To punish mankind for stealing the secrets of fire , Jupiter ordered the other gods to make a poisoned gift for man."
4060,"The polonaise is a slow dance of Polish origin , in 3/4 time . Its name is French for `` Polish . ''"
4061,A space station is an artificial structure designed for humans to live and work in outer space for a period of time.
4062,"Monte Carlo is home to most of the Circuit de Monaco , on which the Formula One Monaco Grand Prix takes place."
4063,"Mudskippers are quite active when out of water , feeding and interacting with one another , for example to defend their territories."
4064,"He said that he called a friend , who told Van der Sloot to go home and who disposed of the body."
4065,McCown performed well enough in the two games Warner missed that Green named McCown the starter for the remainder of the season.
4066,His average of 1.97 goals per game was the first time a goaltender had averaged fewer than two goals against per game.
4067,"The bharal has horns that grow upwards , curve out and then towards the back , somewhat like an upside down mustache."
4068,"Like all insects , beetles ' bodies are divided into three sections : the head , the thorax , and the abdomen."
4069,Outside the two caves is a sub-tropical garden lined with palm trees where one will find many species of trees and flowers.
4070,A tree hollow or tree hole is a semi-enclosed cavity which has naturally formed in the trunk or branch of a tree.
4071,"This was followed by Eliza , set in the Swiss Alps , and Médée , which is Cherubini 's best known work."
4072,"Because demands placed on one liver enzyme can induce activity in another , many molecules become toxic only in combination with others."
4073,"In Japan , Daikokuten , literally , god of great Darkness or Blackness , is one of the Seven Gods of Fortune."
4074,"Many new words were either borrowed from or coined after European languages , especially English , Russian , German , and French."
4075,"Changes at the Platt Lane end took place in 1935 , extending the terracing and providing a roof for the full stand."
4076,"Perhaps the best known cultural reference to Banksia is the `` big bad Banksia men '' of May Gibbs ' children 's book Snugglepot and Cuddlepie . Gibb 's `` Banksia men '' are modelled on the appearance of aged Banksia `` cones '' , with follicles for eyes and other facial features."
4077,"While traveling through a wormhole , subluminal speeds are used . If two points are connected by a wormhole , the time taken to traverse it would be less than the time it would take a light beam to make the journey if it took a path through the space outside the wormhole."
4078,"`` A Moment Like This '' was its first single , followed by `` Miss Independent '' , `` Low '' , and `` The Trouble with Love Is ''."
4079,"Porcupines live in forests , deserts , rocky outcrops , hillsides and grasslands . Some New World porcupines live in trees , but Old World porcupines stay on the ground."
4080,"H. L. Mencken said that `` A dachshund is a half-dog high and a dog-and-a-half long , '' although they have been referred to as `` two dogs long ''."
4081,"The music video for `` Fell on Black Days '' was directed by Jake Scott , who would later direct the music video for `` Burden in My Hand ''."
4082,"Thus , if you wanted to know how much DM 1,000.00 marks in 1960 are worth nowadays , entering would provide a result still in marks , not in euros."
4083,"Because she also showed great promise as a composer , her parents decided to let her study composition with Anton Reicha , at the time composition teacher at the Conservatoire."
4084,"Canada Day , formerly Dominion Day , is Canada 's national day , a federal statutory holiday celebrating the anniversary of the 1 July 1867 enactment of the British North America Act , which united Canada as a single country , which was in turn composed of four provinces . Canada Day observances take place throughout Canada as well as internationally."
4085,"In order to change one 's name , one must apply for the relevant deed poll to be entered on the College 's registers and published in the London Gazette."
4086,"A kangaroo mouse is either one of the two species of jumping mouse native to the deserts of the Southwestern United States , predominantly found in the state of Nevada."
4087,"Eventually , Long got tired of these shenanigans , and at No Way Out 2006 , Booker was told to face Chris Benoit or be stripped of the US title."
4088,"Their alliance later became known in Poland as the `` Alliance of the Three Black Eagles '' , because all three states used a black eagle as a state symbol."
4089,"It was Jupiter who finally saved the day , he promised that if Vulcan released Juno he would give him a wife , Venus the goddess of love and beauty."
4090,"Booklist in 2001 said that `` Marillier 's virtuosic pacing and vivid , filmic style make this an engaging continuation of one of the last year 's best fantasies ''."
4091,"By May 20 , two pandas at the reserve were found to be injured , while the search continued for another two adult pandas that went missing after the quake."
4092,"Many people in the New Orleans metropolitan area expected minimal effects from the storm , but were cleaning up debris and were without power for days after Cindy 's passage."
4093,"When a player takes three or four moves to accomplish what castling would have accomplished in one move , it is sometimes called artificial castling , or castling by hand."
4094,"Pollen caught in webs may also be eaten , and studies have shown that young spiders have a better chance of survival if they have the opportunity to eat pollen."
4095,"Near the end of his life he described his love of his art , `` Each day I go to my studio full of joy ; in the evening when obliged to stop because of darkness I can scarcely wait for the next morning to come ... if I can not give myself to my dear painting I am miserable ''."
4096,"He was caught the next day , but while on the run he had killed the horse and cut his brand out of the hide , thus destroying the evidence."
4097,"The first edition of the latest version of the Tour of Britain took place over five days in early September 2004 , organised by SweetSpot in collaboration with British Cycling."
4098,"Now , let 's say we 've got a more complicated example , like the Lake Shore Limited , which runs from Chicago east to either Boston or New York."
4099,"During the summer practice sessions , the teams in question would cut the players well after signing day thus preventing the cut players from finding new colleges to play for."
4100,"Elena Sergeevna Katina , born October 4 , 1984 , better known as Lena Katina is one half of the Russian music duo t.A.T.u. ; the other being Yulia Volkova."
4101,"Built in two distinct phases , with two new buildings adjacent to the main Waterhouse building , it is the most significant new development project in the museum 's history."
4102,BSELP002 - Cruel & Unusual A. Black Sun Empire - The Cooler B. Black Sun Empire & Corrupt Souls - Everything C. Black Sun Empire - Bitemark D. Black Sun Empire & SKC - Masquerade E. Black Sun Empire & Noisia - Hideous F. Black Sun Empire - Sideways G. Black Sun Empire - Future Frame H. Dino Sofos - Breathe Sunshine
4103,"In the case of the great albatrosses , it can take up to 280 days ; even for the smaller albatrosses , it takes anywhere between 140 and 170 days."
4104,"Both describe God as the One Divine Person , Jesus Christ , who has a Divine Soul of Love , Divine Mind of Truth , and Divine Body of Activity."
4105,"It initially featured one or two PowerPC G4 processors , but was later switched over to the new PowerPC G5 , and now runs on two quad-core Intel Nehalem CPUs."
4106,The Angara 1.1 version is expected to be completed first ; its first launch will reportedly take place in 2012 from the Plesetsk Cosmodrome and in 2014 from Baikonur Cosmodrome.
4107,"Born to a dog demon father and human mother , InuYasha is a half-demon who initially wants to use the powers of the Shikon Jewel to become a full demon."
4108,"Associated with the tower is a 30 m high statue consisting of three figures - one with a hammer , one with a sickle and one with a writing brush."
4109,"Since 2003 , the popularity of live CDs has increased substantially , partly due to Linux Live scripts and remastersys which made it very easy to build customized live systems."
4110,"In early 1938 , Grace sent her to live with yet another one of her aunts , Ana Lower , who lived in the Van Nuys section of Los Angeles."
4111,"There are six black , fleshy filaments , the first pair near the head , the second on the thorax , and the third at the end of the abdomen."
4112,She adopted the stage name `` Nina Simone '' in 1954 because she did not want her mother to know that she was playing `` the devil 's music ''.
4113,"In 1977 , the stone was moved 127 meters to make way for the new motorway passing over the St. Gotthard Pass , at a cost of 300,000 Swiss Francs."
4114,"While bubbles composed mostly of water burst quickly , water containing amphiphiles forms much more stable bubbles , lending more time to the particular bubble to perform these crucial reactions."
4115,"You can also use `` xx '' for a cross , `` xo '' for a black circle on an empty square or `` oo '' for a white one."
4116,"During this time , he played for the New York Rangers , Toronto Maple Leafs , Montreal Canadiens , Chicago Black Hawks , Montreal Maroons , and New York Americans."
4117,"However , in later serials , gold appeared to affect them rather like silver affects werewolves , with gold coins or gold-tipped bullets fired at them having the same effect."
4118,"`` Little Red Riding Hood '' , also known as `` Little Red Cap '' , is a famous fairy tale about a young girl and a big bad wolf."
