,0
0,The two make love.
1,See Great Apostasy.
2,Sheep sound 3.
3,"As one wrestler lost , another one entered."
4,"Soon , they became best friends."
5,The boys make friends.
6,They have two children.
7,Fire begins to return.
8,That isn't true.
9,Telemachus gets home first.
10,"Like many Javanese , Suharto had only one name."
11,Gaye had three children.
12,They have three children.
13,Little of his life and work is known today.
14,Many breeds of horse carry pinto patterns.
15,Three species live in fresh water rivers.
16,She decides to run away from home.
17,The sand here is fine and white with clean water.
18,If I can't get that sound I can't play anything . ''
19,Many Chinese men settled in black communities and in turn married black women.
20,Different instructions may take different amounts of time.
21,Many police officers carry clipboards.
22,"To see a real time example , see."
23,Go ''.
24,The red head has two long black spines with clubbed ends.
25,The two men met in Rome in 1870.
26,This is a Bad Thing.
27,Sushun had one Empress and two Imperial children.
28,See http://www.gnu.org/copyleft/.
29,Trains run every two minutes during peak periods.
30,Two drunken men see the light and walk over to take a closer look.
31,"Well , see you later."
32,See also Fruit tree pollination.
33,See moment.
34,Instruction can take place in Afrikaans as well.
35,See Iowa.
36,I don't know any.
37,Albatross chicks take a long time to fledge.
38,US Alt.
39,Individual dogs may live well beyond the median of their breed.
40,The three men set off for the village.
41,Weismann is much admired today.
42,Gives 0.
43,Many school-aged children can learn a second language.
44,Zeshan is another similar name.
45,"If any time we shall meet another Marooner that Man shall sign his Articles without the Consent of our Company , shall suffer such Punishment as the Captain and Company shall think fit."
46,"The Great Nundle Dog Race , only open to working dogs , is run on the first Sunday in May and attracts many visitors."
47,A team of sled dogs may consist of anywhere from three to two dozen dogs.
48,The first two were Buddhist Rajputs and the last two Hindu Brahmins.
49,529 people were put out of work with three days ' notice.
50,"She said without love , lust is like hunger of a caterpillar."
51,"Ann rolls a 1 , and must end her turn without scoring."
52,"Another early globe , the Hunt-Lenox Globe , ca."
53,The water should be completely changed every two weeks.
54,He doesn't just lie down and take abuse.
55,The children live with the mother for seven years.
56,Many Baba lovers work or live in the vicinity.
57,She performed it live on the album Black Gold.
58,The two men set off for Alcmene 's house.
59,Many people eat lunch while at work or school.
60,No one else can `` know our mind . ''
61,It can't be duplicated in my life . ''
62,New arrivals go to the back of the queue.
63,These are dome-shaped and look like stout little slugs.
64,A match consists of one set or three sets.
65,"The first two sections are meant to represent life , the last two death and transfiguration."
66,Their tails may be from long.
67,"It was nominated for Best Director , Best Picture , and Best Sound."
68,The Old Persian language is one of the two attested Old Iranian languages.
69,Season five follows two time lines.
70,Timmy goes back to save Martin.
71,"Though he had many children , none of them would ever become emperor."
72,Trains generally run every fifteen minutes.
73,LeSieg and one as Rosetta Stone.
74,"Where daylight saving time is used , `` standard time '' may refer to the time without daylight saving time."
75,Genet would never return to prison.
76,"Then relief would come to Saul ; he would feel better , and the evil spirit would leave him . ''"
77,There are also many great parks.
78,It organises Reading Day every year.
79,"Good Night , and Good Luck."
80,"His time abroad would last three years and cost his father $ 2,604.24."
81,Several detachments make up a company.
82,That 's what keeps us going.
83,"By its end , two men simultaneously claimed to be the true pope."
84,Poorer children never went to school.
85,An individual may serve two terms.
86,Opeth performed three special shows in Europe with two song lists each - one acoustic set and one heavy set.
87,Locke never married nor had children.
88,Contemporary multimeters can measure many quantities.
89,However early in the last morning two separate groups of children complete it.
90,"Like , man if I could just grow one , that would take care of a lot of problems . ''"
91,Two has many properties in mathematics.
92,"If nobody notices , nothing happens."
93,Nearly everybody and everything are ominous of good or evil to the Kavirondo.
94,"If any Man shall offer to run away , or keep any Secret from the Company , he shall be marooned with one Bottle of Powder , one Bottle of Water , one small Arm , and Shot."
95,Thousands of boats go into the deep sea to fish and come back with tons of fish.
96,`` I had a great time in New York but couldn't wait to get back ''.
97,"One day , when the pianist didn't arrive by show time , Basie took his place."
98,His libretti were set many times by many different composers.
99,Stephenie will have to go back to Ulong camp alone.
100,"In a two out of three falls match , a wrestler must gain two decisions to win instead of only one."
101,Two and three are the only two consecutive prime numbers.
102,He was paid US$ 200 for two days ' work.
103,Little is known for certain of Josquin 's early life.
104,"Like every economic activity , it has changed over time."
105,The company 's full name is Lidl Stiftung & Co..
106,The name furlong derives from the Old English words and.
107,Longfellow would live there for the remainder of his life.
108,"This template takes three unnamed input parameters ; you must supply the first one , and the last two are optional."
109,The company enter the black forest of Mirkwood without Gandalf.
110,Rachel becomes the new Oracle and spouts another Great Prophecy.
111,Swiss cheese without eyes is known as `` blind . ''
112,This one may be useful in articles with many diagrams.
113,Hercules replies that Zeus could make it work that way.
114,"Like many first-generation DMU classes , they never carried their 125xxx TOPS set numbers."
115,It began full operation two days after a ceremonial opening on 26 May 2006.
116,"O mother mine , words from your lips Are like nectar to my ears."
117,Never a day goes by that I do not think of what happened then.
118,A second fire in 1494 was set by the sons of a hanged thief.
119,One of the largest festivals in Australia used to take place here every April.
120,Heat periods occur about every two weeks and last about 4 to 7 days.
121,Transportation of the first house from Old Adaminaby to New Adaminaby took six days.
122,"One day in early 1997 , Van Der Beek auditioned for three television pilots."
123,A Life for the Tsar was the first of Glinka 's two great operas.
124,The instructions must name these values in order to distinguish them from one another.
125,"They take around three to five years to mature , and may live as long as fifty years."
126,"Members must speak the house language of French , but many also speak English and German as well."
127,"On the other hand , it doesn't allow one to set how many digits must be shown after the decimal dot."
128,"Which is true , in the sense that the black man should want to rob the white man of everything he has."
129,`` Two Cars in Every Garage and Three Eyes on Every Fish '' is the fourth episode of The Simpsons second season.
130,"The name Heimskringla was first used in the 17th century , derived from the first two words of one of the manuscripts."
131,"Keating is `` a man who never could be , but doesn't know it '' . The one sincere thing in Keating 's life is his love for Catherine."
132,The name Proterozoic comes from the Greek `` earlier life ''.
133,Another name for this color is mallow.
134,Brackish water condition commonly occurs when fresh water meets sea water.
135,Three binary operations.
136,"`` Won't Go Home Without You '' is the third single released from Maroon 5 's second album , It Won't Be Soon Before Long."
137,He used another pen name for novels.
138,Others live subtidally.
139,He gave everybody their letters from home.
140,This makes it easy to visualize how days and seasons change.
141,Maybe that makes me a bad actress.
142,He never conducted live in public again.
143,Judgments can be true or not true.
144,Many species of skippers look frustratingly alike.
145,He had three sisters and one brother.
146,"On the first day after , Vulcan stared at this fire for hours on end."
147,In both one can see the geodesics.
148,Grapes include Kékfrankos for red wine and Traminer for white wine.
149,"For the first time , Bahrain hosted the first Grand Prix."
150,The name Beloeil or Belœil is the name of two municipalities.
151,"Another standard designation is `` Canon : Two in One '' , which means two voices in one canon."
152,See Emailing users.
153,Every band was doing that thing . ''
154,See for instructions.
155,It was front-page news for many days.
156,See also :.
157,For examples see.
158,Two is the first Mersenne prime exponent.
159,For his acting work he is credited under his full name.
160,"Many creeks empty into it , but the most water comes from the Mint River."
161,It is very much like a glaive.
162,The lines wouldn't meet until 2003.
163,The work was first performed in 1983.
164,Don't wikilink.
165,Mukda was never forecast to make landfall.
166,It was the first time that two women co-anchored Weekend Update.
167,This template gives the Gregorian serial day.
168,See also Sustainability.
169,It is open weekday mornings without charge.
170,Today the company owns eight Desiro trains.
171,The time server may be a local network time server or an internet time server.
172,See computable number.
173,Today it is used by Old Catholics.
174,One man was injured due a tree falling on his car.
175,There are many types of door hinges.
176,The work is divided in three parts.
177,The same is true of many chitons.
178,It pushed water into the Pamlico Sound.
179,Then the two covenants go different ways.
180,We live with the consequences today . ''
181,It is considered his best poetic work.
182,Samaná has three airports and one harbor.
183,Grace was the first to give evidence.
184,"One person drowned in a cellar in Fort Cobb , and another drowned in Kingfisher."
185,It is long with a tail of.
186,Mangrove trees live right in the water.
187,See modern designs.
188,The mouse dies.
189,Half points awarded.
190,COCPs should be taken at approximately the same time every day.
191,"After another Tribal Council , things got worse for Ulong as they got lost in the dark on their way back to camp."
192,The US military government gives its approval.
193,The regatta is held every year in April for three days.
194,Another storm-related death took place in Seminole.
195,This made it relatively easy to breed from the birds that repeatedly found their way home over long distances.
196,The females give birth to live young.
197,The village maintains a full time police and fire rescue department.
198,See for reference.
199,"To add another line , go here."
200,"As they jump from tree to tree , tarsiers can catch even birds in motion."
201,Clipboards can be made of many things.
202,"Because one man and one women would not be chosen due to the numbers , they would be eliminated."
203,"He was one of Disney 's Nine Old Men , and the last to die."
204,Shelties love to run in wide-open areas.
205,I learned the name Maruzen for the first time through LEMON.
206,BootVis was used to measure boot time.
207,Lyrics are a set of words that make up a song.
208,Arteries are blood vessels that carry blood away from the heart.
209,See key strengthening.
210,Soon Neptune became the internationally accepted name.
211,"Some of the topics include packing , the discovery of long-lost treasures , giving things away , and doing things one last time."
212,"Every year in the first days of June , the Days of Chojnów are celebrated."
213,Pompeii was transformed into a much more public and open place.
214,Gilgamesh is described as two parts god and one part man.
215,It was the last time that solid gold medals were awarded ; modern medals are usually gold plated silver.
216,"For two hours every day , at UTC 10:00 - 11:59 , there are actually three different days observed at the same time."
217,Bad Liebenwerda has a beautiful little park.
218,Never a Goth.
219,"Unfortunately , she doesn't like discomfort."
220,One of the three was John Gregg.
221,The ears are very long and rounded.
222,Sartene wine is appreciated by wine connoisseurs for its good quality.
223,The full name thus became ` Kongl.
224,Lu and Lian Hsiang have two children.
225,"Polish Flag Day was first observed on May 2 , 2004."
226,Most children throw the 1 kg discus.
227,"Like other corvids , they may learn to mimic human speech."
228,This subtemplate gives.
229,A doe generally has one or two fawns at a time.
230,These additions may be new and untested.
231,See documentation there.
232,He is married and has three children.
233,There are 2 sports days every year.
234,Company in 1891.
235,See also Blossom.
236,Many ships and lives were reported lost.
237,"Crocodiles eat fish , birds , mammals and occasionally smaller crocodiles."
238,This was the first time Europe had achieved three successive victories.
239,The second rebuilding took a long time.
240,"In the first twenty minutes of a fawn 's life , the fawn begins to take its first steps."
241,See alto clef.
242,It was men like Dattatreya who helped to make this possible.
243,His mother was his first piano teacher.
244,"I. Every Man Shall obey civil Command ; the Captain shall have one full Share and a half of all Prizes ; the Master , Carpenter , Boatswain and Gunner shall have one Share and quarter."
245,"Blind and naked at birth , they open their eyes after about eighteen days , and are nursed until they are one month old."
246,"In the 24-hour time notation , the day begins at midnight , 00:00 , and the last minute of the day begins at 23:59."
247,"Her first independent production was Diamonds and Guns , a romantic comedy about two friends who go to Las Vegas to find true love."
248,"Every stalactite begins with a single mineral-laden drop of water . When the drop falls , it leaves behind the thinnest ring of calcite."
249,Let comradeship and fervent hope With one voice make us pray Auspicium Melioris Aevi With God to guide the way.
250,The last two or three survivors face a jury historically comprising of at least the last seven players voted off.
251,"His best day at the plate was on June 17 , when he hit two home runs and two doubles."
252,"The novelist Matteo Bandello observed Leonardo at work and wrote that some days he would paint from dawn till dusk without stopping to eat , and then not paint for three or four days at a time."
253,"In the Tokugawa era , every neighborhood had one or two soba establishments , many also serving sake , which functioned much like modern cafes where locals would casually drop by for an informal bite to eat."
254,Kayakers and canoers also take to the lagoon and one can often see scullers as well.
255,Superimposition of two correlated layers comprising parallel lines or curves may give rise line moiré patterns.
256,"Futons must be aired in sunlight regularly , especially if not put away during the day."
257,"A set may be neither closed nor open , either closed or open , or both."
258,"There are also three new songs on the album : `` The Heart Never Lies '' , `` The Way You Make Me Feel '' and `` Don't Wake Me Up ''."
259,It was well east of Bermuda at the time and never would get close to land.
260,"Megan Martha `` Meg '' White is an American drummer best known as one half of the Detroit rock duo The White Stripes , with her ex-husband Jack White."
261,See link to make sure you know what an international version is.
262,Let us live crowned with glory ... or swear to die gloriously.
263,"Two men are killed , but one escapes and flees the woods."
264,"Hear the noise of broken chains , see the noble Equality enthroned."
265,Today Multan is a combination of old and the new Pakistan culture.
266,"The stadium went back to its old name , Arena da Baixada."
267,One way of visualizing optical depth is to think of a fog.
268,He then meets a girl who he thinks is his true love.
269,He that shall be guilty of Drunkenness in time of Engagement shall suffer what Punishment the Captain and Majority of the Company shall think fit.
270,Gestation is 21-30 days and 2-5 young are born at a time.
271,"That is , the first one that is defined and not empty."
272,The two women soon develop a strong bond of love and friendship.
273,"The Canadiens won the first half , and Toronto the second half."
274,A normal tennis game takes place between two of the three contestants.
275,"Meowth loves round objects , as well as shiny , glittering things."
276,From 2008 it will take place for at least another 7 years.
277,Sled dogs are expected to demonstrate two major qualities in their work.
278,In 1994 for the first time two women were elected into government.
279,Take a look at the welcome page to learn more about Wikipedia.
280,`` Let It Go '' appeared on the Set It Off soundtrack.
281,Two sections of Lincoln Park Zoo have been set aside for children.
282,"Without histones , the unwound DNA in chromosomes would be very long."
283,The first bison ever born in captivity was born in Lincoln Park.
284,"To date , Bad Religion has released fourteen studio albums , two EPs , three compilation albums , one live recording , and two DVDs."
285,The club has only ever played one home fixture at another venue.
286,Admitting their guilt for all the war crimes would be one thing.
287,The place of birth is the place where a person was born.
288,"He spent the rest of his life there , leaving three children."
289,Debt consolidation entails taking out one loan to pay off many others.
290,I can't think of any reason to mess with that . ''
291,"Back at camp , Cirie went fishing and caught a sizable fish."
292,"What 's more , I say he can make us all rich."
293,Niagara Falls is divided into the Horseshoe Falls and the American Falls.
294,Used with functions that have done new = abs and lost precision.
295,Lucas was born at Morwenstow and had two brothers and two sisters.
296,"Its passage left about 79,000 people without power and 144,000 without water."
297,"The new version featured a new look , and built-in 3D effects."
298,Smiles promote WikiLove and hopefully this one has made your day better.
299,Most jellyfish undergo two distinct life history stages during their life cycle.
300,"Lee Jinki , born , better known by his stage name Onew."
301,"The nature of these eyes means that if one were to peer into the pupil of an eye , one would see the same image that the organism would see , reflected back out."
302,"At the high photon energies comparable to the electron rest energy of 511 keV , Compton scattering , another process , may take place , and above twice this pair production may take place."
303,"Pyrgopolynices from Miles Gloriosus , in bragging about his long life , says he was born one day later than Jupiter."
304,"`` One Fish , Two Fish , Blowfish , Blue Fish '' is the eleventh episode of The Simpsons second season."
305,I don't see the point of playing in a band and going just one way when you can do everything.
306,They 'd take one look at me and laugh and tell me to home before my mother noticed I was gone.
307,"The name water bear comes from the way they walk , reminiscent of a bear 's gait."
308,Such events may be better placed on a.
309,Red Bull Racing is one of two Formula One teams owned by Austrian beverage company Red Bull.
310,"As in many families at the time , Wesley 's parents gave their children their early education."
311,"Today is , and the current time is."
312,Oars have a flat blade at one end.
313,"To grow well , sunflowers need full sun."
314,Its tail is also usually tipped with white.
315,The distances involved may be short or long.
316,It then goes back to the acoustic section.
317,"Among other things , they eat Rafflesia fruit."
318,Every positive number x has two square roots.
319,One edition of his correspondence fills three volumes.
320,Infantilism may refer to one of the following.
321,Many plants and fungi reproduce asexually as well.
322,The tail may be naked or slightly haired.
323,The area has a long history going back to the time of Alexander the Great 's invasion.
324,Sumbawa lies within the Pacific Ring of Fire.
325,It may have markings or may be unmarked.
326,It drains much of the water of Pothohar.
327,Haydn took two years to complete the work.
328,The group gives Wales full access to and.
329,Butterflies on the other hand possess fine scales.
330,Household debt is the debt held by households.
331,The name has been applied to two municipalities.
332,It is one of the first such document.
333,Hercules says he can't go and the man says he has to because he is Hercules.
334,"When all the earth 's fire begins to go out , Hercules and Deianeira must go in search for fire to stop the world from cold."
335,It has golden-brown fur and large black eyes.
336,It consists three trilogies and three additional books.
337,Hercules helps the refugees take back the city.
338,"Muskrats spend much of their time in the water and are well suited for their semi-aquatic life , both in and out of water . Muskrats can swim under water for 12 to 17 minutes."
339,Each player begins the game with two bishops.
340,"A white flag is a common symbol of surrender , as is the gesture of raising one 's hands empty and open above one 's head."
341,Innovation may refer to one of the following.
342,See the full selection of licensing templates available.
343,Gohar Shahi then married and had three children.
344,Modern roller coasters take on many different forms.
345,Sometime around 1515 Willaert first went to Rome.
346,The remaining three teams would complete the season.
347,Many protists take the form of single-celled flagellates.
348,"However , on election day things had changed."
349,This guy didn't just come to play.
350,The name Weinfelden is first documented in 838.
351,A pair of mandibles lie inside the mouth.
352,His crown and face is violet and black.
353,"At that time one white maggot comes out of the larvae , suspended by a silken thread."
354,"They have two children , Stephie and Max."
355,Dee was married twice and had eight children.
356,Nine million people watch BBC Three every week.
357,The festival take place at Rockefeller Music Hall.
358,The second storm struck just three days later.
359,The two disc set includes songs from 1980-2005.
360,Raisin bread is a bread that contains raisins.
361,Sandwich is the home of the Sandwich Fair.
362,"They have two children , Grace and Henry."
363,Trains run every 10 minutes to Woolwich Arsenal.
364,"They had two children , Suzanne and Christopher."
365,The writer Karl May was born in Ernstthal.
366,"They have a nine-month gestation period , and one or two fawns are born at a time."
367,"My Bengal of Gold , I love you."
368,Early turbine examples are windmills and water wheels.
369,"He also has a tail with a spiked end , as well as having three talon-like toes."
370,"Altogether in Africa , two million speak Spanish."
371,For full season records see Oakland Athletics seasons.
372,"Finally , I wish to speak directly to those who came to London today to take life."
373,Do not place it on every possible word.
374,"Gauri has two children , Aryan and Suhana."
375,The practice of hanami is many centuries old.
376,Its tail feathers are iridescent blue-black with broad white tips on the outer two to three pairs.
377,"The first 2009 Stock train entered passenger service on 21 July 2009 , and one new train will enter service every two weeks from early 2010."
378,Theremin invented another listening device called The Thing.
379,It was his first of two asteroid discoveries.
380,The first geyser they saw was Old Faithful.
381,He turns over and goes back to sleep.
382,To that end the Academy publishes two dictionaries.
383,There may be two subspecies of the Siamang.
384,The two groups have many characteristics in common.
385,"They hear a noise and turn around to see that the monster is not dead , but has now grown two new heads in the place where the previous one was."
386,"HTST pasteurised milk typically has a refrigerated shelf life of two to three weeks , whereas ultra pasteurised milk can last much longer when refrigerated , sometimes two to three months."
387,"`` Nothing to Say '' features drop D tuning , which would become a signature of Soundgarden 's sound on later albums."
388,"Chaplin received three Oscars in his lifetime : one for Best Original Score , one Honorary Award , and one Special Award."
389,"In other words , half of the children of 1932 would be classified as having borderline mental retardation or worse during 1997."
390,"More generally , one may require that flipping a fixed set of bits should change each output bit with probability one half."
391,"Hearing dogs may be trained professionally in as little as three months , though many are trained for closer to a year."
392,Two sections of Lincoln Park Zoo have been set aside for children . The first is the Pritzker Family Children 's Zoo.
393,"Along the way , Timon and Pumbaa meet for the first time and set out to find a `` dream home . ''"
394,For more about the time zones of the U.S. and other time zones see time in the United States and time zone.
395,"Many people have also come to know Leah 's little sister , Lucy who was born with spina bifida and cerebral palsy."
